CONTENT METADATA NO LONGER EXISTS - urn:li:lyndaCourse:3011745,CONTENT METADATA NO LONGER EXISTS - urn:li:lyndaCourse:3011745,Course,2022-04-15 23:09 UTC,N/A,false,N/A,
Learning SQL Programming,"More from LinkedIn Learning's top experts<br><div><a href=""https://www.linkedin.com/newsletters/6758092793329016832?trk=lil-course-description"" target=""_blank"" class=""artdeco-button artdeco-button--1"">Programming Languages Newsletter</a></div><br>Structured Query Language (SQL) is a common tool for retrieving data from relational databases such as SQL Server, MySQL, MariaDB, and PostgreSQL. This course provides an introduction to this core programming language. Learn how to request data from a database, limit and sort the responses, aggregate data from multiple tables with joins, and edit and delete data. Instructor Scott Simpson also shows how to perform simple math operations and transform data into different formats.",Course,2022-11-28 18:11 UTC,N/A,false,N/A,
Building Trust (2018),"Trust is a fundamental aspect of any productive relationship. In business, trust has been proven to decrease turnover, increase innovation, and improve team performance. When trust is compromised, relationships and productivity can suffer. This course shows how professionals of all kinds can build trust with colleagues across their organization. Kelley School of Business senior lecturer Brenda Bailey-Hughes explains how to prove you are trustworthy, even in challenging situations like remote teams, and integrate trust-building habits into your daily routine. She also explains how to practice trust—trusting yourself and others—and rebuild trust when it has been lost. The course features live-action scenarios and practical strategies for boosting trust that will help you apply the concepts to your most important relationships.",Course,2019-08-27 04:27 UTC,N/A,false,N/A,
DJ Patil: Ask Me Anything,"DJ Patil—the former US chief data scientist—boasts a unique perspective on the future, risks, and all-around power of data. In addition to shaping policies at the White House, he's authored influential academic papers and served as head of data products at LinkedIn, where he helped to coin the term ""data scientist."" In this weekly series, DJ tackles questions posed by LinkedIn members, diving into topics ranging from data security to the future of data science. Tune in every Wednesday for a fresh set of answers.",Course,2022-04-02 00:46 UTC,N/A,false,N/A,
AWS for Developers: PayPal Payment Processing with Lambdas,"In many cases payment processing can require a server-side piece, which can be difficult and confusing. AWS provides Lambdas which can solve many of the problems by removing the server configuration and maintenance while still providing the necessary functionality. This course contains the straightforward steps involved in implementing PayPal payment processing using Lambdas. Bear Cahill covers setting up resources, leveraging a local Ruby script with Braintree, creating a Lambda from a Ruby script, calling from an API gateway, handling client payments, and more.",Course,2019-10-08 03:11 UTC,N/A,false,N/A,
Succeeding in DevOps,"DevOps engineer is one of the most in-demand tech jobs on the market. But since this role is still relatively new, aspiring DevOps engineers may have a somewhat murky understanding of what the position entails. In this course, Laura Stone clearly outlines what's expected of DevOps practitioners, as well as what it takes to become a DevOps engineer (and how to excel once you've landed the job). She begins by highlighting the basic qualifications and training needed to land a job as a DevOps practitioner. Next, she provides a technical roadmap for the skills needed to gain an entry-level role in DevOps; shares tips from a DevOps recruiter;  and provides steps for measuring progress and achieving your goals throughout your DevOps career.",Course,2023-03-30 20:31 UTC,N/A,false,N/A,
Python Essential Training (2018),"Due to its power and simplicity, Python has become the scripting language of choice for many large organizations, including Google, Yahoo, and IBM. A thorough understanding of Python 3, the latest version, will help you write more efficient and effective scripts. In this course, Bill Weinman demonstrates how to use Python 3 to create well-designed scripts and maintain existing projects. This course covers the basics of the language syntax and usage, as well as advanced features such as objects, generators, and exceptions. Learn how types and values are related to objects; how to use control statements, loops, and functions; and how to work with generators and decorators. Bill also introduces the Python module system and shows examples of Python scripting at work in a real-world application.",Course,2020-10-25 19:57 UTC,N/A,false,N/A,
Project Management Foundations: Requirements,"<div><a href=""https://www.linkedin.com/newsletters/6772655634862223360?trk=lil-course-description"" target=""_blank"" class=""artdeco-button artdeco-button--1"">View Daniel's LinkedIn Newsletter</a></div><br>Project requirements are how project managers determine what the business needs and align the project’s goals. Requirements also form the basis for defining a project’s scope, assigning resources, and performing acceptance testing. In this course, Daniel Stanton, PMP, introduces an easy, 10-step process to manage the requirements for any project. Find out how to determine applicable standards, identify your stakeholders, gather and analyze requirements, prioritize them, and document your findings. Daniel also explains how to solicit approval for project requirements and manage ongoing change requests.",Course,2020-11-02 18:48 UTC,N/A,false,N/A,
Creating Your First Spring Boot Microservice,"Turbocharge your back-end Java RESTful API development with Spring Boot and Spring Data technologies. This course is intended for experienced Java developers who want to rapidly build microservices that connect with relational databases via the Java Persistence API (JPA). Here, Mary Ellen Bowman walks you through a step-by-step process for building a microservice with an exposed RESTful API featuring HATEOAS, paging, and sorting. Learn about technologies such as Spring Boot, Spring Data JPA, and Spring Data REST, and see how they all come together into smart and elegant solutions. To wrap up, Mary Ellen guides developers in migrating a microservice to a MongoDB data source.",Course,2020-02-26 10:37 UTC,N/A,false,N/A,
Nano Tips for Finding Happiness Through Empathy with Shadé Zahrai,"Welcome to our <i>Nano Tips</i> series, where LinkedIn Learning creators deliver impactful lessons in literally seconds.
<br><br>Happiness is a mindset that begins with empathy for yourself and others - and it is core to fulfillment and success. Join leadership strategist and award-winning peak performance educator Shadé Zahrai as she shares 10 nano tips for elevating your empathy to enhance relationships, foster psychological safety, and create a happy life and career. Shadé explains three types of empathy, offers simple techniques on how to navigate conflict, shares actionable tools to empower others and yourself, and more.",Course,2022-11-29 07:36 UTC,N/A,false,N/A,
Python for Data Science Essential Training,"By using Python to glean value from your raw data, you can simplify the often complex journey from data to value. In this practical, hands-on course, learn how to use Python for data preparation, data munging, data visualization, and predictive analytics. Instructor Lillian Pierson, P.E. covers the essential Python methods for preparing, cleaning, reformatting, and visualizing your data for use in analytics and data science. She helps to provide you with a working understanding of machine learning, as well as outlier analysis, cluster analysis, and network analysis. Plus, Lillian explains how to create web-based data visualizations with Plot.ly, and how to use Python to scrape the web and capture your own data sets.",Course,2017-09-26 12:47 UTC,N/A,true,N/A,
Accelerating Your Career with Personal Branding,"When it comes to accelerating your career, you can’t ignore the importance of your personal brand. Your brand is your voice, your reputation, and a key part of your professional persona. In this course, explore how to use your personal brand to boost your career with award-winning leadership strategist Shadé Zahrai.<br><br>Learn how to get started crafting a standout brand of your own, with practical advice to help you grow, gain recognition, and open new professional doors. Find out how to create compelling and unforgettable personal content, develop authentic work relationships, and elevate your influence along the way. By the end of this course, you’ll be better poised to manage your brand online and cultivate a lasting impression on the job.",Course,2023-01-06 04:31 UTC,N/A,false,N/A,
Big Data Analytics with Hadoop and Apache Spark,"Apache Hadoop was a pioneer in the world of big data technologies, and it continues to be a leader in enterprise big data storage. Apache Spark is the top big data processing engine and provides an impressive array of features and capabilities. When used together, the Hadoop Distributed File System (HDFS) and Spark can provide a truly scalable big data analytics setup. In this course, learn how to leverage these two technologies to build scalable and optimized data analytics pipelines. Instructor Kumaran Ponnambalam explores ways to optimize data modeling and storage on HDFS; discusses scalable data ingestion and extraction using Spark; and provides tips for optimizing data processing in Spark. Plus, he provides a use case project that allows you to practice your new techniques.",Course,2022-06-20 14:20 UTC,N/A,false,N/A,
Excel: Tips and Tricks (2018),"Want to take your Excel game to the next level? In this course, veteran Excel trainer and instructor Dennis Taylor shares powerful tips, tricks, and shortcuts that can help you leverage more of what Excel has to offer. Learn time-saving tricks for creating formulas rapidly, accelerating data entry, and navigating within worksheets efficiently. Plus, discover drag and drop techniques, formatting shortcuts, charting and PivotTable tips, and much more.</br></br>

Note: This course was recorded on Excel for Office 365; however, most of the contents will benefit anyone using Office 2019 or 2016.",Course,2022-07-06 17:58 UTC,N/A,false,N/A,
Level Up: SQL,"These concise (less than 3:30) SQL challenges let you stretch your brain and test your talents. Instructor Scott Simpson frames the challenges in real-world scenarios you might encounter. Tasks range from creating a table to store party guest information to creating a query to find books to feature for a library event.<br><br>This course is integrated with GitHub Codespaces, an instant cloud developer environment that offers all the functionality of your favorite IDE without the need for any local machine setup. With GitHub Codespaces, you can get hands-on practice from any machine, at any time—all while using a tool that you’ll likely encounter in the workplace.<br><br>Each installment of the <em>Level Up</em> series offers at least 15 bite-sized opportunities to practice programming at various levels of difficulty, so you can challenge yourself and reinforce what you’ve learned. Check out the ""Using GitHub Codespaces with this course"" video to learn how to get a codespace up and running.",Course,2023-04-13 17:04 UTC,N/A,false,N/A,
Critical Thinking for Better Judgment and Decision-Making,"The pace of change and volume of information we encounter in daily life make it hard to think through decisions. Instead, people often rely on biases and rules of thumb, which trap them into drawing faulty conclusions. The most successful teams use critical thinking—objective and rational analysis—to illuminate the wisest conclusions. This course prepares leaders to hone the critical thinking skills of their entire organization. Learn how to upgrade critical thinking to avoid deceiving fallacies, spot misleading cognitive biases, craft better arguments, hone judgment, and improve decision-making. Instructor Becki Saltzman teaches skills that will improve how your company or team innovates, tackles challenges, and responds to change.",Course,2021-01-15 19:31 UTC,N/A,false,N/A,
Learning Excel: Data Analysis,"Microsoft Excel is an important tool for data analysis. It helps companies accurately assess situations and make better business decisions. This course helps you unlock the power of your organization's data using the data analysis and visualization tools built into Excel. Author Curt Frye starts with the foundational concepts, including basic calculations such as mean, median, and standard deviation, and provides an introduction to the central limit theorem. He then shows how to visualize data, relationships, and future results with Excel's histograms, graphs, and charts. He also covers testing hypotheses; modeling different data distributions; calculating the covariance and correlation between data sets; and calculating probabilities, combinations, and permutations. Finally, he reviews the process of calculating Bayesian probabilities in Excel. Each chapter includes practical examples that show how to apply the techniques to real-world business problems.",Course,2022-12-30 23:12 UTC,N/A,false,N/A,
Stepping Up Your Webcam Video Presence,"Nearly everyone has a webcam, but many people don’t put the effort into enhancing their webcam video presence. But with just a few relatively easy and inexpensive tweaks, you can capture well-composed, well-lit shots with great audio using the humble webcam. In this course, senior staff instructor Ashley Kennedy shows you how to represent your best self in meetings, as well as presentations, trainings, vlogs, interviews, demos, Q&As, and other types of web videos. Learn basic strategies for optimizing your system and your webcam, staging and lighting your shot, capturing high-quality audio, scripting and rehearsing for big-stakes webcam presentations, and more.",Course,2023-06-08 15:44 UTC,N/A,false,N/A,
Advanced Linux: The Linux Kernel,"What lies at the heart of the Linux operating system? The Linux kernel. Every Linux professional—including those in system administration, operations, and software development—needs to be familiar with the functionality of the Linux kernel as well as the mechanics of configuring and troubleshooting it. Master the fundamentals in this course with Kevin Dankwardt.<br/><br/>Kevin surveys the Linux kernel specification, boot process, and loadable kernel modules. He provides opportunities for you to practice techniques such as searching Linux kernel source code and configuring a Linux kernel from scratch. Challenge and solution videos at the end of almost every chapter allow you to test your new Linux skills along the way.",Course,2022-10-24 16:05 UTC,N/A,false,N/A,
Social Recruiting for Recruiters,"Recruiting talented candidates via social channels has become an important part of a recruiter's job. But how does one best tackle this channel? In this course, instructor Bert Verdonck shares strategies that can help recruiters efficiently and successfully recruit top talent on social platforms. Bert explains how social recruiting fits into the overall recruiting process, which social platforms to focus on, and how to jump-start your social media recruiting presence. He also shares how to find and approach ideal candidates, collaborate with hiring managers, and drive referral recruitment.",Course,2022-03-22 05:11 UTC,N/A,false,N/A,
Understanding the Impact of Deepfake Videos,"Imagine not being able to trust what you see or hear when you watch a video online. Deepfakes are manipulated media—video or audio—where a person has been replaced with someone else's likeness and made to appear as if they said or did something that never happened. Deepfake videos use artificial intelligence and can appear very convincing, even to a trained eye. When used to mislead audiences, deepfake videos can be disastrous. However, they can have useful benefits too—like offering AI-assisted video reshoots. In this introductory course, senior staff instructor Ashley Kennedy offers a useful introduction to the dangers and benefits of deepfake videos. She also provides a high-level overview of deepfake technology and puts forward some tools to identify deepfake videos, as well as suggestions for what to do when you suspect or spot a deepfake video.",Course,2021-09-01 02:27 UTC,N/A,false,N/A,
Account Management: Maintaining Relationships,"Getting the sale is not the end of the sales process. Upselling, return business, network referrals, and so much more can be achieved when a salesperson continues to add value and develop a relationship after that first deal is closed. In this course, sales professional and prospecting coach Miles Croft helps you learn to continue relationship selling with all your existing customers, as well as recover from mistakes in delivery, whether they were your fault or not. Miles explains how account managers and other salespeople can develop connections with their prospects and customers after the initial sale has been made, to continue selling and expand your network even further. He presents a clear walk-through analysis of buying the perfect gifts, never letting a relationship “go rotten,” recovering from mistakes, and much more.  
 
Note: This course was created by Miles Croft. We are pleased to host this training in our library.",Course,2023-02-13 20:54 UTC,N/A,false,N/A,
SQL Server Database Triggers,"SQL Server database triggers help database developers automate routine tasks. Triggers wait for an activating event to occur, then immediately respond with preprogrammed operations. This course, from database expert Adam Wilbert, takes a deep dive into leveraging these powerful and flexible components of a SQL Server database. Follow along and learn how to create and deploy different types of triggers, and get hands-on experience using triggers to solve common problems, such as timestamping data changes or collecting information about table events. Adam also helps you manage your database triggers: enabling, disabling, and reordering triggers as necessary. Plus, follow along with a hands-on project in chapter six, which uses triggers to perform tasks automatically in an inventory management system, such as updating inventory when new product is received.",Course,2023-03-24 22:50 UTC,N/A,false,N/A,
Learning Design Thinking: Lead Change in Your Organization,"Design thinking is a user-centered way of solving problems. It involves extensive collaboration, using strategies such as mapping customer journeys, concept creation, and prototyping. This course teaches leaders how to help their teams adopt a design thinking mindset, and provides examples from author Turi McKinley's work at frog, a global design and strategy firm that transforms businesses at scale by creating systems of brand, product, and service.<br><br>

The course opens with a definition of design thinking, including the roles and spaces required for success. You will then learn how to be a good design thinking leader, with specific advice on topics from setting goals to engaging the different skill sets and personalities in the room (introverts and extroverts alike). Next, Turi dives into creative collaboration: the heart of design thinking. She covers planning, research, and concept creation, and explains how to create a ""service blueprint"" that will help make the design a reality. Chapter 4 introduces prototyping techniques to advance the design.<br><br>
Design thinking is all about collaboration so we've integrated a LinkedIn Group called ""Design Thinking: frog + Lynda.com course."" Throughout the course, the author will suggest opportunities for you to share what you're learning. You'll be able to participate in course-related discussions through your web browser at <a href=""https://linkedin.com/groups/7022790"" target=""blank"">https://linkedin.com/groups/7022790</a> or via the LinkedIn Groups app, which is available for most smartphones. This is a great way to expand your learning and get additional insights from other members taking the course.",Course,2020-05-25 17:05 UTC,N/A,false,N/A,
Career Advice from Some of the Biggest Names in Business,"More from LinkedIn Learning's top experts<br><div><a href=""https://www.linkedin.com/newsletters/6481481946697388032?trk=lil-course-description"" target=""_blank"" class=""artdeco-button artdeco-button--1"">Career Development Newsletter</a></div><br>What if you could get career advice from the world's most influential thinkers, leaders, and innovators? People who have run the top companies, created the most beloved brands, transformed industries, and changed the world? Now you can. This course brings together the best insights from our collection of interviews with LinkedIn Influencers. CEOs such as Richard Branson, Bill Gates, Indra Nooyi, and Meg Whitman reveal what it takes to get your foot in the door and then work your way up. Discover why Starbucks founder Howard Schultz thinks that conviction is so critical, how Oprah found her vision, and what actress Priyanka Chopra does to find the next challenge. Each interview provides short and thoughtful tips you can use to propel your own career in the right direction.",Course,2020-12-30 19:14 UTC,N/A,false,N/A,
Spark for Machine Learning & AI,"Apache Spark is one of the most widely used and supported open-source tools for machine learning and big data. In this course, discover how to work with this powerful platform for machine learning. Instructor Dan Sullivan discusses MLlib—the Spark machine learning library—which provides tools for data scientists and analysts who would rather find solutions to business problems than code, test, and maintain their own machine learning libraries. He shows how to use DataFrames to organize data structure, and he covers data preparation and the most commonly used types of machine learning algorithms: clustering, classification, regression, and recommendations. By the end of the course, you will have experience loading data into Spark, preprocessing data as needed to apply MLlib algorithms, and applying those algorithms to a variety of machine learning problems.",Course,2019-09-21 19:04 UTC,N/A,false,N/A,
Tableau Essential Training (2020.1),"Tableau is a widely used data analytics and visualization tool that many consider indispensable for data-science-related work. Its drag-and-drop interface makes it easy to sort, compare, and analyze data from multiple sources, including Excel, SQL Server, and cloud-based data repositories. In this course, learn what you need to know to analyze and display data using Tableau 2020—and make better, more data-driven decisions for your company. Discover how to install Tableau, connect to data sources, and sort and filter your data. Instructor Curt Frye also demonstrates how to create and manipulate data visualizations—including highlight tables, charts, scatter plots, histograms, maps, and dashboards—and shows how to share your visualizations. Along the way, he highlights the new features packed into this edition of the software, including Viz Animations, which allows you to visually follow the movement of marks in a data visualization to see and understand your changing data.",Course,2021-01-15 07:41 UTC,N/A,false,N/A,
SQL Data Science Code Challenges,"Want to test—and develop—your SQL data-engineering skills? Do you fancy yourself pretty skilled at SQL and want to see just how sharp you are? Then check out this installment of the <i>Code Challenges</i> series, as instructor Harshit Tyagi presents a number of challenges requiring you to write SQL queries to solve problems and answer questions. The challenges start at a relatively low level of difficulty—column selection, filtering rows from data, sorting and grouping query results—and get progressively tougher, testing you on topics like handling missing and invalid data, calculating moving window average, and data transformations. The challenges are all a few minutes long, and use a single database, so you can jump around from challenge to challenge or watch the entire course. So, if you want to see if you’re equal to the tasks, try out these SQL challenges.",Course,2022-04-01 00:25 UTC,N/A,false,N/A,
How to Land Job Interviews without Applying Online,"Applying online is a tough way to land a job, in today’s market. The data shows us that fewer than 2% of candidates who apply online actually get in the door for an interview. So what should you do instead? In this course, Austin Belcak walks you through the steps you can take to generate a steady pipeline of interviews at your target companies — without submitting a single online application! Austin shows you a new approach to job searching that focuses on generating referrals, instead of applying online. He explains ways you can apply this approach directly on LinkedIn, as well. This approach allows you to have more control over landing a job at one of the companies that you really want to work for, and it improves your chances of landing interviews and offers at those companies, without the endless online applications!",Course,2023-07-30 14:57 UTC,N/A,false,N/A,
