SQL Essential Training (2018),"Whatever database application you create—whether it's for bookkeeping, sales, inventory, or even the lowly to-do list—it's all about the data. Completely updated for 2018, <i>SQL Essential Training</i> is designed to help users understand the most common language for database wrangling, SQL. Instructor Bill Weinman teaches all the major features of SQL: creating tables; defining relationships; manipulating strings, numbers, and dates; using triggers to automate actions; and using subselects and views. He offers a solid working knowledge of the language and shows how to retrieve and manage data efficiently. The final chapter includes a real-world example of building a simple and complete database application using SQL.",Course,2019-08-23 20:57 UTC,N/A,false,N/A,
Presenting to Senior Executives,"<div><a href=""https://www.linkedin.com/newsletters/6765070600055635968?trk=lil-course-description"" target=""_blank"" class=""artdeco-button artdeco-button--1"">View Tatiana's LinkedIn Newsletter</a></div><br>Exposure to senior executives (also known as the C suite) can change the trajectory of your career. If you’re presenting to this audience, you need to navigate unique challenges, like getting their attention and garnering action. In this course, learn methods you can use to communicate your message effectively to these key decision makers, resulting in buy-in and response. Discover the value of brevity and the importance of conveying the return on investment (ROI). Learn how to handle challenging questions, frame your message, harness the power of story, and use a high-level approach. Explore how to navigate the unexpected, from interruptions and tech failures to re-engaging the distracted. Additionally, find out how to demonstrate competence, earn credibility, and generate results by making the most of your presentation opportunity.",Course,2023-06-21 12:00 UTC,N/A,false,N/A,
Advanced Python: Working with Databases,"To create functional and useful Python applications, you need a database. Databases allow you to store data from user sessions, track inventory, make recommendations, and more.  However, Python is compatible with many options: SQLite, MySQL, and PostgreSQL, among others. Selecting the right database is a skill that advanced developers are expected to master. This course provides an excellent primer, comparing the different types of databases that can be connected through the Python Database API. Instructor Kathryn Hodge teaches the differences between SQLite, MySQL, and PostgreSQL and shows how to use the ORM tool SQLAlchemy to query a database. The final chapters put your knowledge to practical use in two hands-on projects: developing a full-stack application with Python, PostgreSQL, and Flask and creating a data analysis app with pandas and Jupyter Notebook. By the end, you should feel comfortable creating and using databases and be able to decide which Python database is right for you.",Course,2023-07-26 17:53 UTC,N/A,false,N/A,
"How to Work Smarter, Not Harder: Save Time and Money and Increase Productivity","More and more people are working from home, managing remote teams, and juggling multiple projects. The time is now to learn how to work smarter, not harder. Luckily, today’s technology makes it easier than ever to increase productivity and efficiency. This course is for anyone trying to grow their business or move ahead in their career without becoming overwhelmed. Chelsea Krost provides tangible tips, tools, and techniques to increase overall productivity and give you back precious time in the day. Learn how to embrace the mindset of successful entrepreneurs and small business owners, manage your time effectively, tackle your to-do list, leverage automation and delegation, and power up your social media, content marketing, and branding strategies to direct more attention and traffic to your business. Each tool and workflow has been tested by Chelsea and her clients—and the skills taught apply to any industry. Start watching and working smarter today.",Course,2022-08-06 14:04 UTC,N/A,false,N/A,
Word Essential Training (Microsoft 365),"Learn how to create, edit, format, and share documents with ease using the Microsoft 365 subscription version of Word. Follow along with instructor David Rivers as he gives you an overview of all the essential features of the powerful and ubiquitous word processing app from Microsoft. This course covers how to edit and format text to create a stylish document with instant purpose. Find out how to leverage templates and built-in tools, create numbered and bulleted lists, work with columns and tables, add images to your documents, collaborate on documents with your team, and share documents via OneDrive and email. Along the way, discover how to use and manage the word proofing tools to check spelling and grammar, and get the most out of the latest features of Word for M365, such as Editor, Copilot, and more.",Course,2023-01-23 17:40 UTC,N/A,false,N/A,
Python for Non-Programmers,"Did you know that learning Python is one of the easiest ways to learn to code? It’s true. And in this course you can avoid the jargon and make learning how to code a lot more fun. You don’t have to be an expert technician, either. Join instructor Nick Walter and find out what you need to get started now.<br><br>In this course, Nick teaches the fundamentals of Python to you: a non-programmer, a user with little to no coding experience. Learn more about what Python is, and what it is and isn’t used for. Explore how Python works with numbers and how you can interact with simple programs such as a simple number-guessing game. Find out how to work with text in Python by building a reusable function to count the words in a block of text. And along the way, tackle quick challenges and other games that allow you to put your new skills to the test.",Course,2022-12-27 01:21 UTC,N/A,false,N/A,
C++ Game Programming 1,"Get a fun introduction to the world of game programming with C++. This course teaches the basics of game development with C++ and the OpenGL-powered Simple and Fast Multimedia Library (SFML), using three fully playable sample games: an addictive two-button tapper, a multilevel zombie survival shooter, and a split-screen multiplayer puzzle. Instructor John Horton starts with the very basics of programming, including variables, loops, and conditions. Become more skillful with each game as you move through the key C++ topics, such as object-oriented programming, C++ pointers, and the Standard Template Library. While building these games, you can also learn exciting game programming concepts like collision detection, sprite sheets, views, the HUD (heads-up display), and more.<br><br>

This course was created and produced by Packt Publishing. We are honored to host this training in our library.",Course,2019-09-24 02:25 UTC,N/A,false,N/A,
Python vs. R for Data Science,"Python and R are common programming languages used when working with data. Each language is powerful in its own way; however, it's important that you select the language that will best help you achieve your end result. In this course, data scientist and coding instructor Lavanya Vijayan helps you make this choice, sharing important considerations for using each language in various circumstances. Lavanya starts by going over the background of both languages, as well as the strengths and disadvantages of each in different scenarios. She then walks through the process of working on a data science project and how you'd handle the data at various stages using Python and R. Lavanya then covers how to analyze data using both languages. She rounds out the course by discussing the use cases that play to each language's strengths. By the end of this training, you’ll have the essential information you need to determine whether Python or R is right for you.<br><br>This course was created by <a href=""http://www.onlymadecraft.com"" target=""_blank"">Madecraft</a>. We are pleased to host this training in our library.<br><br><img src=""https://media.licdn.com/media/AAYAAgCwAAoAAQAAAAAAAHppnBQxgeyWS2CsU3aDDPcMgw.jpg"" height=""20%"" width=""20%"">",Course,2023-08-02 21:54 UTC,N/A,false,N/A,
Construction Management: Managing Risk,"Risk is an inherent part of construction and an integral part of the construction manager's job. Over the course of a project, you may have to manage compliance and safety issues, schedule and cost overruns, contract disputes, and more. To be successful, you need to understand the biggest risk factors faced on a job site and how to mitigate them. In this course, OSHA Authorized Outreach Trainer Jim Rogers explains the basics of risk management for construction. Learn how risk changes with the complexity of the project and the type of delivery method being employed. Review your role and the scope of the risk management process, from analysis to control. Along the way, review how technology can help you manage the challenges involved in daily activities using risk analysis and risk mitigation tools.",Course,2021-01-07 08:13 UTC,N/A,false,N/A,
Build Three Real-World Python Applications,"Python skills are in high demand, and programmers who demonstrate real-world skill in building applications are highly sought after. In this course, Megan Silvey shows you how to take real-life programming problems and turn them into actionable results through building three different practical applications. These applications focus on working with popular Python topics: web scraping, web APIs, and text analysis. Check out this course to improve your skills and build applications that you can show off to potential employers.<p>This course is integrated with GitHub Codespaces, an instant cloud developer environment that offers all the functionality of your favorite IDE without the need for any local machine setup. With GitHub Codespaces, you can get hands-on practice from any machine, at any time—all while using a tool that you’ll likely encounter in the workplace.</p>",Course,2023-08-03 13:23 UTC,N/A,false,N/A,
Django: Forms,"Most websites require the use of forms to receive data from users, so it is crucial to know how to safely collect and handle data while maintaining a user-friendly experience on your website. In this course, learn how to use Django to create forms from scratch. Instructor Nick Walter also explains how to deploy forms to your site, access stored data, leverage submitted form data, work with widgets, customize formsets, and more.",Course,2020-10-19 16:52 UTC,N/A,false,N/A,
Software Testing Foundations: Transitioning from Manual to Automation,"<p>In an ever-growing market for new technology, teams need to expand upon their ability to accommodate faster, more frequent testing. Why not take advantage of automation tools and processes to boost your team’s overall testing efficiency? Join instructor and testing expert Mike Fine in this easy-to-follow skills foundations course, as he shows you how to design, implement, and manage a strategic automated software testing program.</p><p>Discover the steps you need to take today to build and automate your own process, everything from analyzing your current systems to selecting the best automation tools available. By the end of this course, you’ll be equipped with new skills to overcome other complex challenges, including troubleshooting issues related to software, mixing and matching, and more.</p>",Course,2023-02-01 13:06 UTC,N/A,false,N/A,
Six Sigma: Green Belt,"Six Sigma is a customer-focused, data-driven methodology that is widely used to analyze and improve the performance of processes, products, and services. In this course, get the training you need to become a Six Sigma Green Belt. Green Belts participate in—or lead—Six Sigma projects on a part-time basis under the guidance of a Black Belt. Operational excellence expert, master Black Belt trainer, and professor Dr. Richard Chua explains how to use Six Sigma and its process, quality, and statistical tools as he prepares you to become a Six Sigma Green Belt.<br><br>   

Note: Dr. Richard Chua builds upon his <i>Six Sigma Foundations</i> and <i>Learning Minitab</i> courses, and covers an array of topics, including measurement system analysis, descriptive statistics, hypothesis testing, design of experiments, statistical process control, and more.",Course,2020-03-20 13:14 UTC,N/A,false,N/A,
Building a Broad Network of Influence,"In this audio-only course from How to Be Awesome at Your Job, Mitch Prinstein helps you to understand the different types of popularity and explains how to boost your popularity by working on your likability. After explaining likability and status, Mitch encourages you to aim for likability and offers multiple tactics to subtly boost your likability. He also points out several potential pitfalls to avoid. Plus, Mitch shares ways to use social media to connect with people, both online and offline.
<br><br>This course was created by Pete Mockaitis of <i><a href=""https://awesomeatyourjob.com/"" target=""_blank"">How to Be Awesome at Your Job</i></a>. We are pleased to offer this training in our library.<br><br><img src=""https://media.licdn.com/media/AAYAAgCwAAoAAQAAAAAAAIBpAic0FsSvQXaA8NB7qnVcIw.jpg"" alt=""Company logo for How to Be Awesome at Your Job"" width=""20%"" height=""20%""/>",Course,2022-07-28 15:54 UTC,N/A,false,N/A,
Data Engineering with AWS Part 1,"Businesses need data experts—now more than ever before. As data-driven decision-making has risen to boardroom prominence, the role of the data expert has become essential to understanding and scaling a business. In this course—the first in a two-part series—instructor Dipali Kulshrestha shows you how to get started on your professional journey and grow your career as a data engineer with AWS.<br><br>Get an introduction to the field of data engineering and why it’s so important in today’s business world. Explore a variety of data types, data lakes, data sources, and how to use built-in AWS components such as DynamoDB, Kinesis, and S3 to store and manage your streams. Find out how to leverage the full power of an end-to-end data engineering pipeline, from selecting and configuring ingestion patterns, to storing data for analytic processing with S3. Test your new skills along the way in the hands-on data challenges at the end of each section.",Course,2023-01-20 13:31 UTC,N/A,false,N/A,
Delivering an Authentic Elevator Pitch,"<div><a href=""https://www.linkedin.com/newsletters/6765070600055635968?trk=lil-course-description"" target=""_blank"" class=""artdeco-button artdeco-button--1"">View Tatiana's LinkedIn Newsletter</a></div><br>Find out how to craft an authentic personal pitch while projecting competence and warmth—two key factors in making a great first impression. Instructor Tatiana Kolovou shares how building trust with people and making a positive first impression isn’t a matter of magic. Tatiana reveals how verbal and nonverbal behaviors can influence the way people react in an initial meeting, whether in person, over the phone, or online.",Course,2020-12-24 16:15 UTC,N/A,false,N/A,
Advanced NLP with Python for Machine Learning,"An incredible amount of unstructured text data is generated every day by social media, web pages, and a variety of other sources. But without the ability to tame and harness that data, you'll be unable to glean any value from it. In this course, learn how to translate messy text data into powerful insights using Python. Instructor Derek Jedamski begins 
with a quick review of foundational NLP concepts, including how to clean text data and build a model on top of vectorized text. He then jumps into more complex topics such as word2vec, doc2vec, and recurrent neural networks. To wrap up the course, he lends these concepts a real-world context by applying them to a machine learning problem.",Course,2020-12-11 16:54 UTC,N/A,false,N/A,
Python Code Challenges ,"Want to test your Python skills? These concise challenges let you stretch your brain and test your talents. Instructor Barron Stone shares over a dozen Python challenges, as well as his own solutions to each problem—the majority of which are less than two dozen lines of code. You can tackle each problem using the tools in the Python standard library, or opt for the library of your choice. And since each challenge is self-contained, you can complete the course in any order—and at your own pace. Tune in to get the hands-on practice you need to keep your skills sharp.",Course,2020-10-22 19:15 UTC,N/A,false,N/A,
Writing a Tech Resume,"When you apply for technology jobs, your resume is your opportunity to stand out from the crowd. Emma Bostian shows you how to showcase your technology skills, framing them to impress recruiters and potential employers. Discover how to tailor the content and length to catch a hiring manager’s eye. Learn how to leverage minor design details like spacing, font choice, and color palette to differentiate your resume from the rest, without stepping too far out. Plus, learn how to create a professional online presence on the platforms tech recruiters use most: LinkedIn and GitHub.",Course,2022-09-16 17:43 UTC,N/A,false,N/A,
Figure Drawing: Tonal Rendering,"How can you make a good figure drawing into a great figure drawing? Give it drama with tonal rendering. This course—taught on the iPad Pro—provides you with step-by-step demonstrations that can help you enhance the dimensionality and drama of your figure drawings using tonal rendering techniques. Instructor Amy Wynne starts by demonstrating how to create a five-part tonal gradient, and then shows how to apply this to simple 3D geometric shapes such as an egg, a cylinder, and a block; these shapes serve as the building blocks for constructing your figures. Amy also shows how to build the figure from the inside out—from structure to tonality—and apply silhouette and camouflage using inspiring master drawings as examples. Upon completing this course, you'll be equipped with a few simple techniques that can help you add beautiful lights and shadows to your figure sketches.",Course,2020-04-11 05:36 UTC,N/A,false,N/A,
Teamwork Essentials: Stand Out as a Valuable Team Member,"When you think of all the skills you could work on to advance your career, how often do you think about being a valuable team member? Almost never? In reality, working well with a team involves more than just a frame of mind, it takes a specific set of skills. In this course, leadership strategist Shadé Zahrai teaches you effective strategies to not only be a great teammate, but also how to develop skills while working with teams that will strengthen your reputation within your organization. She first shows you how to identify your own style of engaging with others, then how to use that information to cultivate strong relationships on the teams that you’re on by elevating the work of your teammates and nurturing trust. Shadé explains ways to build culture on the teams by fostering collaboration, navigating conflict, and creating an environment of psychological safety. Finally, learn techniques to develop strategic thinking skills that will serve your teams and help you solve problems.",Course,2023-07-03 12:28 UTC,N/A,false,N/A,
MLOps Essentials: Model Development and Integration,"Machine Learning Operations (MLOps) is a fast-growing domain the field of AI. As more models are deployed in production, the need for a structured, agile, end-to-end ML lifecycle with automation has grown multifold. MLOps provides structure to machine learning projects and help them succeed over the long run. In this course, instructor Kumaran Ponnambalam focuses on the key concepts of MLOps and helps you apply these concepts to your day-to-day ML work. Kumaran introduces you to the machine learning life cycle and explains unique challenges with ML, as well as important definitions and principles. He walks you through the requirements and design for ML projects, then dives into data processing and management. Kumaran explains various tools and technologies that you can use in the automation and management of continuous training. He covers best practices for model management, then offers detailed instruction on continuous integration.",Course,2023-05-28 15:41 UTC,N/A,false,N/A,
Wireshark Essential Training,"Are you interested in learning about packet analysis, or understanding and identifying the traffic on your network? This course gives you a solid overview of deep packet inspection via Wireshark Next Generation. Instructor Lisa Bock helps you navigate the many features of Wireshark. Lisa begins with the benefits of traffic analysis and discusses how to tap into the data stream effectively. She shows you how to get started with Wireshark, including filters and shortcuts you can use. Lisa walks you through the Transmission Control Protocol (TCP) connection process, as well as IPv6, ICMPv6, DNS, DHCP, and more. To wrap up, Lisa summarizes common protocols that you may use with deep packet analysis, such as FTP, HTTP, and ARP. Lisa walks you through all the basics, so no previous experience with Wireshark is necessary.",Course,2023-01-31 01:33 UTC,N/A,false,N/A,
Raspberry Pi Essential Training,"In this introductory class to the Raspberry Pi, technologist Mark Niemann-Ross explains the vocabulary associated with this single-board computer, then shows you how to plug in peripherals and perform basic computing tasks. Mark first describes how the Raspberry Pi compares to other computers and how it can be used as a media server, musical instrument, robotics controller, and more. He covers the members of the Raspberry Pi family and how to select the one that is right for you and the accessories that you need to use it effectively. Mark walks you through connecting your Raspberry Pi to wi-fi and ethernet, as well as getting it started. After examining operating systems for Raspberry Pi, he goes into why a virtual networking computer (VNC) for Raspberry Pi can be very helpful and how you can enable and use one. Mark discusses sound on your Raspberry Pi and how to use and control the GPIO board. After going over Raspberry Pi hardware, he dives into the Raspberry Pico microcontroller, then finishes up with how to run the Raspberry Pi OS on other computers.
<br><br>
Note: This course was created by Mark Niemann-Ross. We are pleased to host this training in our library.",Course,2022-11-21 04:20 UTC,N/A,false,N/A,
Learn Animation Production in Blender 2.9,"Have you ever wanted to create an animated scene, but thought it was too complicated, or just didn’t know where to start? Then try this course from Darrin Lile, as he walks you through the creation of an animated scene using Blender, a free, open-source software. Darrin shares a scene of a spaceship landing in a cargo bay, and then shows you everything that goes into making that scene, from the first polygon to the final render. He details how to import reference images to create 3D models, how to use the Node Editor to create the materials and textures for the 3D objects, and how to build star fields, planets, and cloud layers. He then dives into the animation, starting with the landing gear, and explains how to use the Graph Editor as you bring the ship in for a landing. To finish the animation, Darrin shows you how to mix music and sound effects in the Video Sequence Editor, before executing the final render of the animated scene.

<br><br>
Note: This course was created by Darrin Lile. We are pleased to host this training in our library.",Course,2023-02-20 21:06 UTC,N/A,false,N/A,
Web Scraping with Python,"Instructor Ryan Mitchell teaches the practice of web scraping using the Python programming language. Ryan helps you understand how a human browsing the web is different from a web scraper. She introduces the Chrome developer tools and how to use them to examine network calls. Ryan shows you how to install Scrapy with pip and how to write some ""Hello, World"" code to scrape a simple web page. She covers how to use the Scrapy LinkExtractor to find internal links on a web page, then demonstrates how to configure Scrapy and the ItemPipeline to write data to various file formats. Ryan walks you through best practices for organizing your projects, writing reusable parsers, and future-proofing your spiders. She explains how APIs work and how they can be used to retrieve data directly. Ryan explores headers and cookies, then goes into browser automation and how to integrate Selenium with Scrapy. In conclusion, she offers ideas to continue your studies in computer science and think creatively about automation.",Course,2023-02-24 16:17 UTC,N/A,false,N/A,
Nano Tips for Developing Magnetic Charisma with Shadé Zahrai,"Welcome to our <i>Nano Tips</i> series, where LinkedIn Learning creators deliver impactful lessons in literally seconds. In this installment, find out why charisma is such a valuable skill and how you can develop your own charisma with ease, exploring key insights from award-winning leadership strategist and peak performance specialist Shadé Zahrai.<br><br>Gather strategies to build authentic charisma to start creating better first impressions and new connections today. Get tips on energizing others with charismatic presence and magnetic communication. Along the way, Shadé shows you techniques for using eye contact, pauses, presentation starts, tension-building tools, simplified language, genuine care, and more.",Course,2022-12-15 00:04 UTC,N/A,false,N/A,
